{
  "$schema": "https://json-schema.org/draft/2020-12/schema",
  "$id": "https://northstar.example/schemas/DATA-282.schema.json",
  "title": "DATA-282 ProductionBlocker",
  "type": "object",
  "required": [
    "id",
    "version",
    "authority_effect"
  ],
  "properties": {
    "id": {
      "type": "string",
      "minLength": 1
    },
    "version": {
      "type": "string",
      "pattern": "^\\\\d+\\\\.\\\\d+\\\\.\\\\d+$"
    },
    "authority_effect": {
      "const": "none"
    },
    "payload": {
      "type": "object"
    }
  },
  "additionalProperties": false
}